"Indonesia","Jalan Yos Sudarso 81 - 83, 68421 Banyuwangi, Indonesia","68421","Jawa Timur","Jalan Yos Sudarso 81 - 83","Buffet",,,"Salah satu pilihan utama kami di Banyuwangi.Terletak di Banyuwangi, berjarak12 km dari Watu Dodol, ILLIRA Hotel Banyuwangi menawarkan kamar-kamar dengan AC. Di antara fasilitas di akomodasi ini adalah resepsionis 24 jam, ruang penyimpanan bagasi, dan Wi-Fi gratis di seluruh area akomodasi. Hotel ini memiliki kolam renang outdoor dan menyuguhkan pemandangan kota, dan Anda dapat menikmati hidangan di restoran atau minuman di bar.
Hotel ini menyediakan pilihan sarapan prasmanan dan a la carte setiap pagi.
Taman Nasional Baluran berjarak 41 km dari ILLIRA Hotel Banyuwangi. Bandara terdekat adalah Bandara Banyuwangi, 24 km dari akomodasi, dan akomodasi menyediakan layanan antar-jemput bandara berbayar.","https://q-cf.bstatic.com/images/hotel/max1024x768/142/142595513.jpg",,"ILLIRA Hotel Banyuwangi","24","1.5","8.8","164","true"," 2 single ","Sarapan Rp 150.000 - skor: Baik","Non-refundable",,"Rp","27 m²","Balkon","Pemandangan kota","AC","Kamar mandi pribadi","Minibar","Wi-Fi gratis","Peralatan mandi","Shower","Brankas","Toilet","Lantai keramik/marmer","Sandal","Pembuat teh/kopi","Kamar terhubung","Papan Jemur Baju","Rak pengering baju","Tisu toilet",,,,,,,,,,,,,,,,,,,,,,,,,,,,,,"2","1.5","Kamar Eager Twin","true"," 2 single ","Termasuk sarapan - skor: Baik","Non-refundable","TANPA UANG MUKA – Bayar di akomodasi","Rp","27 m²","Balkon","Pemandangan kota","AC","Kamar mandi pribadi","Minibar","Wi-Fi gratis","Peralatan mandi","Shower","Brankas","Toilet","Lantai keramik/marmer","Sandal","Pembuat teh/kopi","Kamar terhubung","Papan Jemur Baju","Rak pengering baju","Tisu toilet",,,,,,,,,,,,,,,,,,,,,,,,,,,,,,,"2","1.8","Kamar Eager Twin","true"," 1 super-king ","Sarapan Rp 150.000 - skor: Baik","Non-refundable",,"Rp","27 m²","Balkon","Pemandangan kota","AC","Kamar mandi pribadi","Minibar","Wi-Fi gratis","Peralatan mandi","Shower","Brankas","Toilet","Lantai keramik/marmer","Sandal","Pembuat teh/kopi","Kamar terhubung","Papan Jemur Baju","Rak pengering baju","Tisu toilet","Selengkapnya",,,,,,,,,,,,,,,,,,,,,,,,,,,"2","1.5","Kamar Eager King","true"," 1 super-king ","Termasuk sarapan - skor: Baik","Non-refundable","TANPA UANG MUKA – Bayar di akomodasi","Rp","27 m²","Balkon","Pemandangan kota","AC","Kamar mandi pribadi","Minibar","Wi-Fi gratis","Peralatan mandi","Shower","Brankas","Toilet","Lantai keramik/marmer","Sandal","Pembuat teh/kopi","Kamar terhubung","Papan Jemur Baju","Rak pengering baju","Tisu toilet","Selengkapnya",,,,,,,,,,,,,,,,,,,,,,,,"2","1.8","Kamar Eager King","true"," Pilih tempat tidur (jika tersedia) 2 single 1 super-king ","Termasuk sarapan - skor: Baik","Non-refundable","TANPA UANG MUKA – Bayar di akomodasi","Rp","31 m²","Balkon","Pemandangan kota","AC","Kamar mandi pribadi","Minibar","Wi-Fi gratis","Peralatan mandi","Shower","Brankas","Toilet","Lantai keramik/marmer","Sandal","Pembuat teh/kopi","Papan Jemur Baju","Rak pengering baju","Tisu toilet","Selengkapnya",,,,,,,,,,,,,,,,,,,,,"2","2.1","Kamar Adorable Deluxe Double","true"," 1 double besar ","Termasuk sarapan - skor: Baik","Non-refundable","TANPA UANG MUKA – Bayar di akomodasi","Rp","27 m²","Pemandangan kota","AC","TV layar datar","Minibar","Wi-Fi gratis","Handuk","Seprai","Lantai keramik/marmer","Meja kerja","Sandal","TV satelit","Kamar terhubung","Layanan bangun tidur","Akses lounge eksekutif","Papan Jemur Baju","Semua unit bisa diakses dengan kursi roda","Selengkapnya",,,,,,,,,,,,,,,,,,,,,,,"2","2.55","Lantai Eksekutif King","true"," 2 single ","Termasuk sarapan - skor: Baik","Non-refundable","TANPA UANG MUKA – Bayar di akomodasi","Rp","27 m²","Pemandangan kota","AC","TV layar datar","Minibar","Wi-Fi gratis","Handuk","Seprai","Lantai keramik/marmer","Meja kerja","Sandal","TV satelit","Kamar terhubung","Layanan bangun tidur","Akses lounge eksekutif","Papan Jemur Baju","Semua unit bisa diakses dengan kursi roda","Selengkapnya",,,,,,,,,,,,,,,,,,,,,"2","2.55","Lantai Eksekutif Twin",,,,,,,,,,,,,,,,,,,,,,,,,,,,,,,,,,,,,,,,,,,,,,,,,,,,,,,,,,,,,,,,,,,,,,,,,,,,,,,,,,,,,,,,,,,,,,,,,,,,,,,,,,,,,,,,,,,,,,,,,,,,,,,,,,,,,,,,,,,,,,,,,,,,,,,,,,,,,,,,,,,,,,,,,,,,,,,,,,,,,,,,,,,,,,,,,,,,,,,,,,,,,,,,,,,,,,,,,,,,,,,,,,,,,,,,,,,,,,,,,,,,,,,,,,,,,,,,,,,,,,,,,,,,,,,"4","Hotel","https://www.booking.com/hotel/id/illira.id.html?checkin=2020-06-25&checkout=2020-06-28&selected_currency=IDR&changed_currency=1&top_currency=1&lang=id&group_adults=2&no_rooms=1"
"Indonesia","Jl. MH Thamrin Gg. Mawar No. 01, Banyuwangi, 68414 Banyuwangi, Indonesia","68414","Jawa Timur","Jl. MH Thamrin Gg. Mawar No. 01","Termasuk sarapan lezat dengan semua pilihan",,,"Salah satu pilihan utama kami di Banyuwangi.Berjarak 16 km dari Watu Dodol, Mango Tree Guest House menawarkan akomodasi dengan lounge bersama, taman, dan resepsionis 24 jam untuk kenyamanan Anda. Wi-Fi dan tempat parkir pribadi dapat diakses di homestay secara gratis.
Ada area tempat duduk dan ruang makan di semua unit.
Pilihan sarapan prasmanan dan Asia tersedia setiap pagi di Mango Tree Guest House.
Akomodasi bintang 3 ini menawarkan pemandian air panas dan teras.
Rental sepeda dan mobil tersedia di Mango Tree Guest House.
Taman Nasional Baluran berjarak 44 km dari homestay. Bandara terdekat adalah Bandara Banyuwangi, 22 km dari Mango Tree Guest House, dan tersedia layanan antar-jemput bandara berbayar.","https://cf.bstatic.com/images/hotel/max1024x768/191/191211203.jpg",,"Mango Tree Guest House","22","165","8.9","432","true"," 1 single ","Termasuk sarapan - skor: Hebat","Pembatalan GRATIS sebelum 23.59 pada 23 Juni 2020","TANPA UANG MUKA – Bayar di akomodasi","Rp","Wi-Fi gratis","Toilet","Bathtub atau shower","Seprai","Stop kontak dekat tempat tidur","Lantai keramik/marmer","Area tempat duduk","Pembuat teh/kopi","Toilet bersama","Kamar mandi bersama","Kipas angin","Furnitur outdoor","Area makan outdoor","Lemari","Ruang makan","Meja makan","Semua unit terletak di lantai dasar","Tisu toilet","Semua unit bisa diakses dengan kursi roda",,,,,,,,,,,,,,,,,,,,,,,,,,,,,"1","165","Tempat Tidur Single dalam Kamar Asrama","true"," 1 tempat tidur tingkat ","Termasuk sarapan - skor: Hebat","Pembatalan GRATIS sebelum 23.59 pada 23 Juni 2020","TANPA UANG MUKA – Bayar di akomodasi","Rp","21 m²","Balkon","AC","Teras","Wi-Fi gratis","Hot tub","Toilet","Bathtub atau shower","Seprai","Stop kontak dekat tempat tidur","Lantai keramik/marmer","Area tempat duduk","Pintu masuk pribadi","Pembuat teh/kopi","Kamar mandi bersama","Furnitur outdoor","Area makan outdoor","Ruang makan","Meja makan","Semua unit terletak di lantai dasar","Tisu toilet","Semua unit bisa diakses dengan kursi roda","Selengkapnya",,,,,,,,,,,,,,,,,,,,,,,,,,"1","210","Tempat tidur dalam Kamar Asrama Campuran 8-Tempat Tidur",,,,,,,,,,,,,,,,,,,,,,,,,,,,,,,,,,,,,,,,,,,,,,,,,,,,,,,,,,,,,,,,,,,,,,,,,,,,,,,,,,,,,,,,,,,,,,,,,,,,,,,,,,,,,,,,,,,,,,,,,,,,,,,,,,,,,,,,,,,,,,,,,,,,,,,,,,,,,,,,,,,,,,,,,,,,,,,,,,,,,,,,,,,,,,,,,,,,,,,,,,,,,,,,,,,,,,,,,,,,,,,,,,,,,,,,,,,,,,,,,,,,,,,,,,,,,,,,,,,,,,,,,,,,,,,,,,,,,,,,,,,,,,,,,,,,,,,,,,,,,,,,,,,,,,,,,,,,,,,,,,,,,,,,,,,,,,,,,,,,,,,,,,,,,,,,,,,,,,,,,,,,,,,,,,,,,,,,,,,,,,,,,,,,,,,,,,,,,,,,,,,,,,,,,,,,,,,,,,,,,,,,,,,,,,,,,,,,,,,,,,,,,,,,,,,,,,,,,,,,,,,,,,,,,,,,,,,,,,,,,,,,,,,,,,,,,,,,,,,,,,,,,,,,,,,,,,,,,,,"3","Homestay","https://www.booking.com/hotel/id/mango-tree-guest-house.id.html?checkin=2020-06-25&checkout=2020-06-28&selected_currency=IDR&changed_currency=1&top_currency=1&lang=id&group_adults=2&no_rooms=1"
"Indonesia","Jl. Raya Situbondo KM 17 Gg. Bangsring Breeze, Bangsring, Wongsorejo, 68453 Banyuwangi, Indonesia","68453","Jawa Timur","Jl. Raya Situbondo KM 17 Gg. Bangsring Breeze, Bangsring, Wongsorejo","Termasuk sarapan enak dengan semua pilihan",,,"Salah satu pilihan utama kami di Banyuwangi.Hanya berjarak 15 menit berkendara dari Pelabuhan Ketapang di Banyuwangi, Bangsring Breeze menawarkan akomodasi menakjubkan yang menghadap ke Taman Bali Barat dan Pulau Menjangan. Properti ini juga menawarkan layanan penjemputan bandara gratis serta akses WiFi gratis.
Dibutuhkan waktu 20 menit berkendara dari properti ke pusat kota Banyuwangi, dan sekitar 40 menit berkendara untuk mencapai Bandara Banyuwangi. Kawah Ijen yang terkenal berselang sekitar 1 jam dengan mobil.
Unit-unit bungalow yang elegan di Bangsring Breeze dilengkapi dengan Ac, TV layar datar, minibar, dan fasilitas membuat teh atau kopi. Kamar mandi dalamnya menyediakan shower dengan pengering rambut. Anda dapat menikmati pemandangan laut dan gunung dari teras.
Berbagai kegiatan di luar ruangan yang menakjubkan seperti kitesurfing, selancar angin, snorkelling, menyelam, hiking, dan bersepeda gunung dapat diatur di meja layanan wisata.
Untuk pilihan bersantap, Bangsring Breeze Restaurant di lokasi menyajikan hidangan lokal Jawa Timur dan Barat. Sebuah minimarket dapat ditemukan hanya dalam 15 menit berkendara.","https://cf.bstatic.com/images/hotel/max1024x768/603/60310643.jpg",,"Bangsring Breeze","20","4.74","9.1","65","true"," 1 super-king ","Termasuk sarapan - skor: Baik","Bisa dikembalikan sebagian",,"Rp","50 m²","Balkon","Pemandangan laut","Pemandangan taman","Pemandangan gunung","Kolam dengan pemandangan","AC","Patio","Kamar mandi pribadi","TV layar datar","Teras","Minibar","Wi-Fi gratis","Peralatan mandi","Jubah mandi","Brankas","Bidet","Toilet","Sofa","Bathtub atau shower","Handuk","Seprai","Stop kontak dekat tempat tidur","Lantai keramik/marmer","Meja kerja","Area tempat duduk","Pintu masuk pribadi","TV","Sandal","Lemari es","Fasilitas setrika","TV satelit","Pembuat teh/kopi","Pengering rambut","Tempat tidur ekstra panjang (> 2 meter)","Pemutar DVD","Ketel listrik","Furnitur outdoor","Area makan outdoor","Layanan bangun tidur","Lemari","Papan Jemur Baju","Rak pengering baju","Tisu toilet","Papan permainan/puzzle","Buku, DVD, atau musik untuk anak","Ranjang sofa","2","4.74","Suite dengan Balkon","true"," 1 super-king ","Termasuk sarapan - skor: Baik","Bisa dikembalikan sebagian",,"Rp","50 m²","Balkon","Pemandangan laut","Pemandangan taman","Pemandangan kolam renang","Pemandangan gunung","Kolam dengan pemandangan","AC","Patio","Kamar mandi pribadi","TV layar datar","Teras","Minibar","Wi-Fi gratis","Peralatan mandi","Jubah mandi","Brankas","Bidet","Toilet","Sofa","Bathtub atau shower","Handuk","Seprai","Stop kontak dekat tempat tidur","Lantai keramik/marmer","Meja kerja","Area tempat duduk","Pintu masuk pribadi","TV","Sandal","Lemari es","Fasilitas setrika","TV satelit","Pembuat teh/kopi","Pengering rambut","Tempat tidur ekstra panjang (> 2 meter)","Pemutar DVD","Ketel listrik","Furnitur outdoor","Area makan outdoor","Layanan bangun tidur","Lemari","Papan Jemur Baju","Rak pengering baju","Tisu toilet","Papan permainan/puzzle","Buku, DVD, atau musik untuk anak","Selengkapnya","2","4.74","Bungalow","true"," 2 single ","Termasuk sarapan - skor: Baik","Bisa dikembalikan sebagian",,"Rp","30 m²","Balkon","Pemandangan taman","Pemandangan kolam renang","Kolam dengan pemandangan","AC","Patio","Kamar mandi pribadi","TV layar datar","Teras","Minibar","Wi-Fi gratis","Peralatan mandi","Jubah mandi","Brankas","Bidet","Toilet","Bathtub atau shower","Handuk","Seprai","Stop kontak dekat tempat tidur","Lantai keramik/marmer","Meja kerja","Area tempat duduk","Pintu masuk pribadi","TV","Sandal","Lemari es","Fasilitas setrika","TV satelit","Pembuat teh/kopi","Pengering rambut","Tempat tidur ekstra panjang (> 2 meter)","Pemutar DVD","Ketel listrik","Furnitur outdoor","Area makan outdoor","Layanan bangun tidur","Lemari","Papan Jemur Baju","Rak pengering baju","Tisu toilet","Papan permainan/puzzle","Buku, DVD, atau musik untuk anak","Selengkapnya","2","4.74","Kamar Twin dengan Balkon",,,,,,,,,,,,,,,,,,,,,,,,,,,,,,,,,,,,,,,,,,,,,,,,,,,,,,,,,,,,,,,,,,,,,,,,,,,,,,,,,,,,,,,,,,,,,,,,,,,,,,,,,,,,,,,,,,,,,,,,,,,,,,,,,,,,,,,,,,,,,,,,,,,,,,,,,,,,,,,,,,,,,,,,,,,,,,,,,,,,,,,,,,,,,,,,,,,,,,,,,,,,,,,,,,,,,,,,,,,,,,,,,,,,,,,,,,,,,,,,,,,,,,,,,,,,,,,,,,,,,,,,,,,,,,,,,,,,,,,,,,,,,,,,,,,,,,,,,,,,,,,,,,,,,,,,,,,,,,,,,,,,,,,,,,,,,,,,,,,,,,,,,,,,,,,,,,,,,,,,,,,,,,,,,,,,,,,,,,,,,,,,,,,,,,,,,,,,,,,,,,,,,,,,,,,,,,,,,,,,,,,,,,,,,,,,,,,,,,,,,,,,,,,,,,,,,,,,,,,,,,,,,"3","Hotel","https://www.booking.com/hotel/id/bangsring-breeze.id.html?checkin=2020-06-25&checkout=2020-06-28&selected_currency=IDR&changed_currency=1&top_currency=1&lang=id&group_adults=2&no_rooms=1"
"Indonesia","Jl. Jaksa Agung Suprapto Gg. Annur RT4/RW2, Welaran Barat, 68416 Banyuwangi, Indonesia","68416","Jawa Timur","Jl. Jaksa Agung Suprapto Gg. Annur RT4/RW2, Welaran Barat","Termasuk sarapan sempurna dengan semua pilihan",,,"Terletak di Banyuwangi, 30 km dari Watu Dodol, Osingvacation menyediakan akomodasi dengan lounge bersama, Wi-Fi gratis, resepsionis 24 jam, dan layanan kamar. B&B ini memiliki taman dan tempat parkir pribadi gratis.
Ada area tempat duduk, ruang makan, dan dapur lengkap dengan kompor.
Anda dapat menikmati sarapan khas Asia di B&B ini.
Osingvacation menawarkan teras. Akomodasi ini menyediakan layanan rental sepeda dan mobil.
Bandara terdekat adalah Bandara Banyuwangi, 33 km dari Osingvacation. Akomodasi ini menawarkan layanan antar-jemput bandara berbayar.","https://r-cf.bstatic.com/images/hotel/max1024x768/210/210900699.jpg",,"Osingvacation","19","465","8.7","71","true"," 1 double besar ","Termasuk sarapan - skor: Istimewa","Bisa dikembalikan sebagian","TANPA UANG MUKA – Bayar di akomodasi","Rp","Bathtub","Wi-Fi gratis","Shower","Dapur","Toilet","Sofa","Perapian","Handuk","Alat bersih-bersih","Lantai keramik/marmer","Area tempat duduk","Alat press celana","Pintu masuk pribadi","Fasilitas setrika","Pembuat teh/kopi","Setrika","Toilet bersama","Kamar mandi bersama","Kamar terhubung","Peralatan dapur","Kipas angin","Tempat tidur ekstra panjang (> 2 meter)","Kamar rias","Handuk/seprai dengan biaya tambahan","Jam alarm/layanan bangun tidur","Ketel listrik","Layanan bangun tidur","Jam alarm","Lemari","Kompor","Ruang makan","Meja makan","Semua unit terletak di lantai dasar","Papan Jemur Baju","Rak pengering baju","Tisu toilet",,,,,,,,,,,,"2","465","Kamar Budget Double","true"," 1 double besar ","Termasuk sarapan - skor: Istimewa","Bisa dikembalikan sebagian","TANPA UANG MUKA – Bayar di akomodasi","Rp","Bathtub","Wi-Fi gratis","Shower","Dapur","Toilet","Sofa","Perapian","Handuk","Alat bersih-bersih","Lantai keramik/marmer","Area tempat duduk","Alat press celana","Pintu masuk pribadi","Fasilitas setrika","Pembuat teh/kopi","Setrika","Toilet bersama","Kamar mandi bersama","Kamar terhubung","Peralatan dapur","Kipas angin","Tempat tidur ekstra panjang (> 2 meter)","Kamar rias","Handuk/seprai dengan biaya tambahan","Jam alarm/layanan bangun tidur","Ketel listrik","Layanan bangun tidur","Jam alarm","Lemari","Kompor","Ruang makan","Meja makan","Semua unit terletak di lantai dasar","Papan Jemur Baju","Rak pengering baju","Tisu toilet",,,,,,,,,,,,,"1","441.75","Kamar Budget Double",,,,,,,,,,,,,,,,,,,,,,,,,,,,,,,,,,,,,,,,,,,,,,,,,,,,,,,,,,,,,,,,,,,,,,,,,,,,,,,,,,,,,,,,,,,,,,,,,,,,,,,,,,,,,,,,,,,,,,,,,,,,,,,,,,,,,,,,,,,,,,,,,,,,,,,,,,,,,,,,,,,,,,,,,,,,,,,,,,,,,,,,,,,,,,,,,,,,,,,,,,,,,,,,,,,,,,,,,,,,,,,,,,,,,,,,,,,,,,,,,,,,,,,,,,,,,,,,,,,,,,,,,,,,,,,,,,,,,,,,,,,,,,,,,,,,,,,,,,,,,,,,,,,,,,,,,,,,,,,,,,,,,,,,,,,,,,,,,,,,,,,,,,,,,,,,,,,,,,,,,,,,,,,,,,,,,,,,,,,,,,,,,,,,,,,,,,,,,,,,,,,,,,,,,,,,,,,,,,,,,,,,,,,,,,,,,,,,,,,,,,,,,,,,,,,,,,,,,,,,,,,,,,,,,,,,,,,,,,,,,,,,,,,,,,,,,,,,,,,,,,,,,,,,,,,,,,,,,,,"1","Bed & Breakfast","https://www.booking.com/hotel/id/osingvacation.id.html?checkin=2020-06-25&checkout=2020-06-28&selected_currency=IDR&changed_currency=1&top_currency=1&lang=id&group_adults=2&no_rooms=1"
"Indonesia","Jl. Letjen S Parman Gg. Merpati No.25Pakis, Kec. Banyuwangi, Kabupaten Banyuwangi, Jawa Timur, Banyuwangi, 68419 Banyuwangi, Indonesia","68419","Jawa Timur","Jl. Letjen S Parman Gg. Merpati No.25Pakis, Kec. Banyuwangi, Kabupaten Banyuwangi, Jawa Timur","Kontinental, Italia, Vegetarian, Vegan, Halal, Bebas gluten, Asia, A la Amerika, Buffet",,,"Salah satu yang paling laris di Banyuwangi Terletak di Banyuwangi, 20 km dari Watu Dodol, Cheap Inn Banyuwangi menyediakan akomodasi dengan taman, parkir pribadi gratis, dan teras. Hotel bintang 2 ini menawarkan WiFi gratis, layanan kamar, dan mesin ATM. Hotel menyediakan kamar-kamar keluarga.
Di hotel, setiap kamar dilengkapi dengan meja kerja. Menampilkan pemandangan taman, kamar-kamar di cheap inn Banyuwangi memiliki kamar mandi bersama dengan bidet dan amenitas kamar mandi gratis. Di akomodasi, semua kamar mencakup area tempat duduk.
Cheap inn Banyuwangi menawarkan sarapan kontinental atau prasmanan.
Bandara terdekat adalah Bandara Banyuwangi, 17 km dari hotel.","https://cf.bstatic.com/images/hotel/max1024x768/189/189439348.jpg",,"Cheap Inn Banyuwangi","21","216.363","8.4","26","true"," 1 double besar ","Sarapan Rp 10.000 - skor: Istimewa","Pembatalan GRATIS sebelum 23.59 pada 21 Juni 2020",,"Rp","Balkon","Pemandangan taman","Pemandangan kota","Patio","Teras","Peralatan mandi","Bidet","Toilet","Bathtub atau shower","Handuk","Seprai","Stop kontak dekat tempat tidur","Meja kerja","Area tempat duduk","Pintu masuk pribadi","Sandal","Fasilitas setrika","Setrika","Toilet bersama","Kamar mandi bersama","Kamar rias","Jam alarm/layanan bangun tidur","Lantai berkarpet","Layanan bangun tidur","Pemanggang roti","Ruang makan","Meja makan","Lantai atas hanya bisa diakses dengan tangga","Papan Jemur Baju","Ranjang lipat","Rak pengering baju","Tisu toilet",,,,,,,,,,,,,,,,"2","216.363","Kamar Economy Double","true"," 1 double besar ","Sarapan Rp 10.000 - skor: Istimewa","Pembatalan GRATIS sebelum 23.59 pada 21 Juni 2020",,"Rp","Balkon","Pemandangan taman","Pemandangan kota","AC","Patio","Teras","Peralatan mandi","Bidet","Toilet","Bathtub atau shower","Handuk","Seprai","Stop kontak dekat tempat tidur","Meja kerja","Area tempat duduk","Pintu masuk pribadi","Sandal","Fasilitas setrika","Setrika","Toilet bersama","Kamar mandi bersama","Kamar rias","Jam alarm/layanan bangun tidur","Lantai berkarpet","Layanan bangun tidur","Pemanggang roti","Ruang makan","Meja makan","Semua unit terletak di lantai dasar","Lantai atas hanya bisa diakses dengan tangga","Papan Jemur Baju","Ranjang lipat","Rak pengering baju","Tisu toilet","Semua unit bisa diakses dengan kursi roda","Selengkapnya",,,,,,,,,,,,,"2","306","Kamar Budget Double","true"," 1 double besar ","Sarapan Rp 10.000 - skor: Istimewa","Pembatalan GRATIS sebelum 23.59 pada 21 Juni 2020",,"Rp","16 m²","Balkon","Pemandangan taman","Pemandangan kota","AC","Patio","Teras","Peralatan mandi","Bidet","Toilet","Bathtub atau shower","Handuk","Seprai","Stop kontak dekat tempat tidur","Meja kerja","Area tempat duduk","Pintu masuk pribadi","Sandal","Fasilitas setrika","Setrika","Toilet bersama","Kamar mandi bersama","Kamar terhubung","Kamar rias","Jam alarm/layanan bangun tidur","Lantai berkarpet","Layanan bangun tidur","Pemanggang roti","Ruang makan","Meja makan","Semua unit terletak di lantai dasar","Lantai atas hanya bisa diakses dengan tangga","Papan Jemur Baju","Ranjang lipat","Rak pengering baju","Tisu toilet","Semua unit bisa diakses dengan kursi roda","Selengkapnya",,,,,,,,"2","340","Kamar Deluxe Double","true"," 2 double ","Sarapan Rp 10.000 - skor: Istimewa","Pembatalan GRATIS sebelum 23.59 pada 21 Juni 2020",,"Rp","32 m²","Balkon","Pemandangan taman","Pemandangan kota","AC","Patio","Teras","Peralatan mandi","Bidet","Toilet","Bathtub atau shower","Handuk","Seprai","Stop kontak dekat tempat tidur","Meja kerja","Area tempat duduk","Pintu masuk pribadi","Sandal","Fasilitas setrika","Setrika","Toilet bersama","Kamar mandi bersama","Kamar terhubung","Kamar rias","Jam alarm/layanan bangun tidur","Lantai berkarpet","Layanan bangun tidur","Pemanggang roti","Ruang makan","Meja makan","Semua unit terletak di lantai dasar","Lantai atas hanya bisa diakses dengan tangga","Papan Jemur Baju","Ranjang lipat","Rak pengering baju","Tisu toilet","Semua unit bisa diakses dengan kursi roda","Selengkapnya",,,,,"4","680","Kamar Keluarga","true"," 1 tempat tidur tingkat ","Sarapan Rp 10.000 - skor: Istimewa","Pembatalan GRATIS sebelum 23.59 pada 21 Juni 2020",,"Rp","32 m²","Balkon","Pemandangan taman","Pemandangan kota","AC","Patio","Teras","Peralatan mandi","Bidet","Toilet","Bathtub atau shower","Handuk","Seprai","Stop kontak dekat tempat tidur","Meja kerja","Area tempat duduk","Pintu masuk pribadi","Sandal","Fasilitas setrika","Setrika","Toilet bersama","Kamar mandi bersama","Kamar rias","Jam alarm/layanan bangun tidur","Layanan bangun tidur","Pemanggang roti","Ruang makan","Meja makan","Lantai atas hanya bisa diakses dengan tangga","Papan Jemur Baju","Ranjang lipat","Rak pengering baju","Tisu toilet","Selengkapnya",,,,,"1","123.636","Tempat Tidur Susun di Kamar Asrama Pria","true"," 1 tempat tidur tingkat ","Sarapan Rp 10.000 - skor: Istimewa","Pembatalan GRATIS sebelum 23.59 pada 21 Juni 2020",,"Rp","24 m²","Balkon","Pemandangan taman","Pemandangan kota","AC","Patio","Teras","Peralatan mandi","Bidet","Toilet","Bathtub atau shower","Handuk","Seprai","Stop kontak dekat tempat tidur","Meja kerja","Area tempat duduk","Pintu masuk pribadi","Sandal","Fasilitas setrika","Setrika","Toilet bersama","Kamar mandi bersama","Kamar rias","Jam alarm/layanan bangun tidur","Lantai berkarpet","Layanan bangun tidur","Pemanggang roti","Ruang makan","Meja makan","Lantai atas hanya bisa diakses dengan tangga","Papan Jemur Baju","Ranjang lipat","Rak pengering baju","Tisu toilet","Selengkapnya",,,,,,"1","123.636","Tempat Tidur Susun di Kamar Asrama Wanita",,,,,,,,,,,,,,,,,,,,,,,,,,,,,,,,,,,,,,,,,,,,,,,,,,,,,,,,,,,,,,,,,,,,,,,,,,,,,,,,,,,,,,,,,,,,,,,,,,,,,,,,,,,,,,,,,,,,,,,,,,,,,,,,,,,,,,,,,,,,,,,,,,,,,,,,,,,,,,,,,,,,,,,,,,,,,,,,,,,,,,,,,,,,,,,,,,,,,,,,,,,,,,,,,,,,,,,,,,,,,,,,,,,,,,,,,,,,,,,,,,,,,,,,,,,,,,,,,,,,,,,,,,,,,,,,,,,,,,,,,,,,,,,,,,,,,,,,,,,,,,,,,,,,,,,,,,,,,,"2","Homestay","https://www.booking.com/hotel/id/cheap-inn-banyuwangi-banyuwangi.id.html?checkin=2020-06-25&checkout=2020-06-28&selected_currency=IDR&changed_currency=1&top_currency=1&lang=id&group_adults=2&no_rooms=1"
