"Indonesia","Jalan Gatot Subroto KM 6, 68421 Banyuwangi, Indonesia","68421","Jawa Timur","Jalan Gatot Subroto KM 6","Kontinental, Halal, Asia, A la Amerika, Buffet",,,"Salah satu pilihan utama kami di Banyuwangi.Ketapang Indah Hotel berlokasi tidak jauh dari Pantai Ketapang - bisa dicapai dengan berjalan kaki saja. Akomodasi ini menawarkan sebuah kolam renang outdoor berukuran besar yang mencakup teras berjemur, serta meja bagian penerima tamu 24-jam. Wi-Fi gratis tersedia di seluruh area hotel.
Ketapang Indah Hotel menampilkan kamar-kamar ber-AC yang memiliki TV satelit, lemari pakaian, dan meja dengan area tempat duduk. Semua kamar juga dilengkapi dengan ketel listrik dan teras yang menyuguhkan pemandangan. Kamar mandi dalam menawarkan shower atau bathtub.
Hotel ini berselang 10 menit berkendara dari Pelabuhan Ketapang dan 15 menit berkendara dari pusat kota Banyuwangi. Akomodasi dapat dicapai dalam waktu 45 menit berkendara dari Bandara Blimbingsari.
Ketapang Indah Hotel menyediakan ruang permainan yang meliputi fasilitas tenis meja, fasilitas rapat, serta taman bermain anak-anak untuk kenyamanan Anda. Layanan binatu, antar-jemput bandara dan berbagai wisata dapat diatur berdasarkan permintaan.
Wahoo Restaurant menampilkan suasana semi-terbuka serta menyajikan masakan Asia, Indonesia, dan Eropa yang Halal. Restoran ini buka selama 24 jam.","https://q-cf.bstatic.com/images/hotel/max1024x768/200/200730883.jpg",,"Ketapang Indah Hotel","14","1.527","8.7","483","true"," Pilih tempat tidur (jika tersedia) 1 super-king 2 single ","Sarapan Rp 118.000 - skor: Hebat","Pembatalan GRATIS sebelum 23.59 pada 23 Juni 2020","TANPA UANG MUKA – Bayar di akomodasi","Rp","25 m²","Balkon","Pemandangan taman","AC","Patio","Kamar mandi dalam","TV layar datar","Teras","Wi-Fi gratis","Peralatan mandi","Shower","Brankas","Toilet","Handuk","Seprai","Stop kontak dekat tempat tidur","Lantai keramik/marmer","Meja kerja","Area tempat duduk","TV","Sandal","Telepon","TV satelit","Pembuat teh/kopi","Toilet tamu","Handuk/seprai dengan biaya tambahan","Jam alarm/layanan bangun tidur","Ketel listrik","Furnitur outdoor","Area makan outdoor","TV kabel","Layanan bangun tidur","Jam alarm","Lemari","Semua unit terletak di lantai dasar","Lantai atas hanya bisa diakses dengan tangga","Papan Jemur Baju","Tisu toilet","Semua unit bisa diakses dengan kursi roda",,,,,,,,,"2","1.527","Kamar Superior Double atau Twin","true"," Pilih tempat tidur (jika tersedia) 1 super-king 2 single ","Termasuk sarapan - skor: Hebat","Pembatalan GRATIS sebelum 23.59 pada 23 Juni 2020","TANPA UANG MUKA – Bayar di akomodasi","Rp","25 m²","Balkon","Pemandangan taman","AC","Patio","Kamar mandi dalam","TV layar datar","Teras","Wi-Fi gratis","Peralatan mandi","Shower","Brankas","Toilet","Handuk","Seprai","Stop kontak dekat tempat tidur","Lantai keramik/marmer","Meja kerja","Area tempat duduk","TV","Sandal","Telepon","TV satelit","Pembuat teh/kopi","Toilet tamu","Handuk/seprai dengan biaya tambahan","Jam alarm/layanan bangun tidur","Ketel listrik","Furnitur outdoor","Area makan outdoor","TV kabel","Layanan bangun tidur","Jam alarm","Lemari","Semua unit terletak di lantai dasar","Lantai atas hanya bisa diakses dengan tangga","Papan Jemur Baju","Tisu toilet","Semua unit bisa diakses dengan kursi roda",,,,,,,,,,"2","1.583","Kamar Superior Double atau Twin","true"," Pilih tempat tidur (jika tersedia) 1 double besar 2 single ","Termasuk sarapan - skor: Hebat","Pembatalan GRATIS sebelum 23.59 pada 23 Juni 2020","TANPA UANG MUKA – Bayar di akomodasi","Rp","25 m²","Balkon","Pemandangan taman","AC","Patio","Kamar mandi dalam","TV layar datar","Teras","Minibar","Wi-Fi gratis","Peralatan mandi","Shower","Brankas","Toilet","Handuk","Seprai","Stop kontak dekat tempat tidur","Lantai keramik/marmer","Meja kerja","Area tempat duduk","TV","Sandal","Telepon","TV satelit","Pembuat teh/kopi","Toilet tamu","Handuk/seprai dengan biaya tambahan","Jam alarm/layanan bangun tidur","Ketel listrik","Furnitur outdoor","Area makan outdoor","TV kabel","Layanan bangun tidur","Jam alarm","Lemari","Semua unit terletak di lantai dasar","Lantai atas hanya bisa diakses dengan tangga","Papan Jemur Baju","Tisu toilet","Semua unit bisa diakses dengan kursi roda","Selengkapnya",,,,,"2","1.77","Kamar Superior Double atau Twin dengan Pemandangan Taman","true"," Pilih tempat tidur (jika tersedia) 1 double besar 2 single ","Termasuk sarapan - skor: Hebat","Pembatalan GRATIS sebelum 23.59 pada 23 Juni 2020","TANPA UANG MUKA – Bayar di akomodasi","Rp","32 m²","Balkon","Pemandangan taman","AC","Patio","Kamar mandi dalam","TV layar datar","Teras","Minibar","Wi-Fi gratis","Peralatan mandi","Shower","Brankas","Toilet","Handuk","Seprai","Stop kontak dekat tempat tidur","Lantai keramik/marmer","Meja kerja","Area tempat duduk","TV","Sandal","Telepon","TV satelit","Pembuat teh/kopi","Pengering rambut","Toilet tamu","Handuk/seprai dengan biaya tambahan","Jam alarm/layanan bangun tidur","Ketel listrik","Furnitur outdoor","Area makan outdoor","TV kabel","Layanan bangun tidur","Jam alarm","Mesin Pengering baju","Lemari","Semua unit terletak di lantai dasar","Papan Jemur Baju","Tisu toilet","Semua unit bisa diakses dengan kursi roda","Selengkapnya","2","1.927","Cottage Deluxe Double atau Twin dengan Pemandangan Taman","true"," Pilih tempat tidur (jika tersedia) 2 single 1 double besar ","Termasuk sarapan & makan malam","Pembatalan GRATIS sebelum 23.59 pada 23 Juni 2020","TANPA UANG MUKA – Bayar di akomodasi","Rp","25 m²","Balkon","Pemandangan taman","AC","Patio","Kamar mandi dalam","TV layar datar","Teras","Minibar","Wi-Fi gratis","Peralatan mandi","Shower","Brankas","Toilet","Handuk","Seprai","Stop kontak dekat tempat tidur","Lantai keramik/marmer","Meja kerja","Area tempat duduk","TV","Sandal","Telepon","TV satelit","Pembuat teh/kopi","Toilet tamu","Handuk/seprai dengan biaya tambahan","Jam alarm/layanan bangun tidur","Ketel listrik","Furnitur outdoor","Area makan outdoor","TV kabel","Layanan bangun tidur","Lemari","Lantai atas hanya bisa diakses dengan tangga","Papan Jemur Baju","Tisu toilet","Selengkapnya","2","2.112","Superior Double or Twin Room with Garden View with DINNER","true"," Pilih tempat tidur (jika tersedia) 1 super-king 2 single ","Termasuk sarapan & makan malam","Pembatalan GRATIS sebelum 23.59 pada 23 Juni 2020","TANPA UANG MUKA – Bayar di akomodasi","Rp","32 m²","Balkon","Pemandangan taman","AC","Patio","Kamar mandi dalam","TV layar datar","Teras","Minibar","Wi-Fi gratis","Peralatan mandi","Shower","Brankas","Toilet","Handuk","Seprai","Stop kontak dekat tempat tidur","Lantai keramik/marmer","Meja kerja","Area tempat duduk","TV","Sandal","Telepon","TV satelit","Pembuat teh/kopi","Pengering rambut","Toilet tamu","Handuk/seprai dengan biaya tambahan","Jam alarm/layanan bangun tidur","Ketel listrik","Furnitur outdoor","Area makan outdoor","TV kabel","Layanan bangun tidur","Mesin Pengering baju","Lemari","Semua unit terletak di lantai dasar","Papan Jemur Baju","Tisu toilet","Selengkapnya","2","2.213","Deluxe Double or Twin Cottage with Garden View with DINNER",,,,,,,,,,,,,,,,,,,,,,,,,,,,,,,,,,,,,,,,,,,,,,,,,,,,,,,,,,,,,,,,,,,,,,,,,,,,,,,,,,,,,,,,,,,,,,,,,,,,,,,,,,,,,,,,,,,,,,,,,,,,,,,,,,,,,,,,,,,,,,,,,,,,,,,,,,,,,,,,,,,,,,,,,,,,,,,,,,,,,,,,,,,,,,,,,,,,,,,,,,,,,,,,,,,,,,,,,,,,,,,,,,,,,,,,,,,,,,,,,,,,,,,,,,,,,,,,,,,,,,,,,,,,,,,,,,,,,,,,,,,,,,,,,,,,,,,,,,,,,,,,,,,,,,,,,,,,,,"4","Hotel","https://www.booking.com/hotel/id/ketapang-indah.id.html?checkin=2020-06-25&checkout=2020-06-28&selected_currency=IDR&changed_currency=1&top_currency=1&lang=id&group_adults=2&no_rooms=1"
"Indonesia","Jalan Stasiun Karangasem No 2, 68431 Banyuwangi, Indonesia","68431","Jawa Timur","Jalan Stasiun Karangasem No 2",,,,"Salah satu pilihan utama kami di Banyuwangi.Sritanjung Homestay terletak di Banyuwangi, 20 km dari Watu Dodol, dan menawarkan akomodasi dengan lounge bersama, tempat parkir pribadi gratis, taman, serta teras. Guest house bintang 1 ini menyediakan Wi-Fi gratis, layanan resepsionis 24 jam, dan dapur bersama. Akomodasi bebas alergi ini berjarak 49 km dari Taman Nasional Baluran.
Semua kamar di guest house ini memiliki area tempat duduk.
Bandara terdekat adalah Bandara Banyuwangi, 22 km dari Sritanjung Homestay.","https://q-cf.bstatic.com/images/hotel/max1024x768/118/118283933.jpg",,"Sritanjung Homestay","12","261","8.8","288","true"," 1 double besar ","Pembatalan GRATIS sebelum 23.59 pada 23 Juni 2020","TANPA UANG MUKA – Bayar di akomodasi",,"Rp","20 m²","Pemandangan taman","Kedap suara","Teras","Toilet","Bathtub atau shower","Handuk","Seprai","Stop kontak dekat tempat tidur","Alat bersih-bersih","Bebas alergi","Lantai keramik/marmer","Area tempat duduk","Pintu masuk pribadi","Toilet bersama","Kamar mandi bersama","Peralatan dapur","Dapur kecil","Kipas angin","Tempat tidur ekstra panjang (> 2 meter)","Kamar rias","Handuk/seprai dengan biaya tambahan","TV kabel","Lemari","Ruang makan","Meja makan","Papan Jemur Baju","Tisu toilet","Semua unit bisa diakses dengan kursi roda",,,,,,,,,,,,,,,,,,,"2","261","Kamar Standard Double","true"," 1 double ","Pembatalan GRATIS sebelum 23.59 pada 23 Juni 2020","TANPA UANG MUKA – Bayar di akomodasi",,"Rp","25 m²","Pemandangan taman","Kamar mandi dalam","Kedap suara","Teras","Toilet","Sofa","Bathtub atau shower","Handuk","Seprai","Stop kontak dekat tempat tidur","Alat bersih-bersih","Bebas alergi","Lantai keramik/marmer","Area tempat duduk","Pintu masuk pribadi","Peralatan dapur","Dapur kecil","Kipas angin","Toilet tamu","Tempat tidur ekstra panjang (> 2 meter)","Kamar rias","Handuk/seprai dengan biaya tambahan","Area makan outdoor","Lemari","Ruang makan","Meja makan","Papan Jemur Baju","Tisu toilet","Ranjang sofa","Selengkapnya",,,,,,,,,,,,,,,,,,"2","345","Kamar Double dengan Kamar Mandi Pribadi","true"," 1 double besar ","Pembatalan GRATIS sebelum 23.59 pada 23 Juni 2020","TANPA UANG MUKA – Bayar di akomodasi",,"Rp","30 m²","AC","Kamar mandi pribadi","TV layar datar","Kedap suara","Toilet","Bathtub atau shower","Handuk","Stop kontak dekat tempat tidur","Alat bersih-bersih","Bebas alergi","Lantai keramik/marmer","Area tempat duduk","Kamar rias","Papan Jemur Baju","Tisu toilet","Selengkapnya",,,,,,,,,,,,,,,,,,,,,,,,,,,,,"2","525","Kamar Double dengan Kamar Mandi Pribadi","true"," 2 super-king ","Pembatalan GRATIS sebelum 23.59 pada 23 Juni 2020","TANPA UANG MUKA – Bayar di akomodasi",,"Rp","30 m²","Pemandangan taman","Kamar mandi dalam","Kedap suara","Teras","Peralatan mandi","Toilet","Bathtub atau shower","Handuk","Seprai","Stop kontak dekat tempat tidur","Alat bersih-bersih","Bebas alergi","Lantai keramik/marmer","Area tempat duduk","Pintu masuk pribadi","Peralatan dapur","Dapur kecil","Kipas angin","Toilet tamu","Tempat tidur ekstra panjang (> 2 meter)","Handuk/seprai dengan biaya tambahan","Area makan outdoor","Meja makan","Papan Jemur Baju","Tisu toilet","Selengkapnya",,,,,,,,,,,,,,,,"4","480","Kamar Double atau Twin dengan Kamar Mandi","true"," 1 single ","Pembatalan GRATIS sebelum 23.59 pada 23 Juni 2020","TANPA UANG MUKA – Bayar di akomodasi",,"Rp","35 m²","Pemandangan","Kedap suara","Toilet","Bathtub atau shower","Handuk","Seprai","Stop kontak dekat tempat tidur","Alat bersih-bersih","Bebas alergi","Lantai keramik/marmer","Area tempat duduk","Pintu masuk pribadi","Toilet bersama","Kamar mandi bersama","Kipas angin","Handuk/seprai dengan biaya tambahan","Papan Jemur Baju","Tisu toilet","Selengkapnya",,,,,,,,,,,,,,,,,,,"1","150","Tempat Tidur Single dalam Kamar Asrama",,,,,,,,,,,,,,,,,,,,,,,,,,,,,,,,,,,,,,,,,,,,,,,,,,,,,,,,,,,,,,,,,,,,,,,,,,,,,,,,,,,,,,,,,,,,,,,,,,,,,,,,,,,,,,,,,,,,,,,,,,,,,,,,,,,,,,,,,,,,,,,,,,,,,,,,,,,,,,,,,,,,,,,,,,,,,,,,,,,,,,,,,,,,,,,,,,,,,,,,,,,,,,,,,,,,,,,,,,,,,,,,,,,,,,,,,,,,,,,,,,,,,,,,,,,,,,,,,,,,,,,,,,,,,,,,,,,,,,,,,,,,,,,,,,,,,,,,,,,,,,,,,,,,,,,,,,,,,,,,,,,,,,,,,,,,,,,,,,,,,,,,,,,,,,,,,,,,,,,,,,,,,,,"1","Guest house","https://www.booking.com/hotel/id/shanum-homestay.id.html?checkin=2020-06-25&checkout=2020-06-28&selected_currency=IDR&changed_currency=1&top_currency=1&lang=id&group_adults=2&no_rooms=1"
"Indonesia","Jl. Yos Sudarso Klatak, 68421 Banyuwangi, Indonesia","68421","Jawa Timur","Jl. Yos Sudarso Klatak",,,,"Salah satu pilihan utama kami di Banyuwangi.Terletak di Banyuwangi, 12 km dari Watu Dodol, Dialoog Banyuwangi menyediakan akomodasi dengan restoran, tempat parkir pribadi gratis, kolam renang luar ruangan, dan bar. Terletak 41 km dari Taman Nasional Baluran, hotel ini memiliki taman dan area pantai pribadi. Akomodasi ini menawarkan resepsionis 24 jam, antar-jemput bandara, layanan kamar, dan Wi-Fi gratis di seluruh areanya.
Semua unit memiliki AC, TV kabel layar datar, teko, bidet, perlengkapan mandi gratis, dan meja. Kamar mandi bersamanya dilengkapi dengan shower. Setiap kamar di hotel ini memiliki lemari pakaian dan kamar mandi pribadi.
Sarapan ala carte disajikan setiap hari di Dialoog Banyuwangi.
Akomodasi ini menawarkan taman bermain anak-anak. Daerahnya populer untuk bersepeda, dan rental sepeda dan mobil tersedia di Dialoog Banyuwangi.
Bandara terdekat adalah Bandara Banyuwangi, 25 km dari hotel.","https://r-cf.bstatic.com/images/hotel/max1024x768/161/161868008.jpg",,"Dialoog Banyuwangi","13","4.398","8.3","99","true"," 1 super-king ","Sarapan sudah termasuk dalam harga","Non-refundable",,"Rp","36 m²","Balkon","Pemandangan halaman dalam","AC","TV layar datar","Wi-Fi gratis","Peralatan mandi","Shower","Jubah mandi","Brankas","Bidet","Toilet","Handuk","Seprai","Stop kontak dekat tempat tidur","Lantai keramik/marmer","Meja kerja","Area tempat duduk","Pintu masuk pribadi","TV","Sandal","Telepon","Pembuat teh/kopi","Kamar mandi bersama","Kamar rias","Ketel listrik","TV kabel","Layanan bangun tidur","Lemari","Semua unit terletak di lantai dasar","Lantai atas bisa dicapai dengan lift","Papan Jemur Baju","Tisu toilet",,,,,,,,,,,,,,,"2","4.398","Kamar Deluxe King","true"," 1 super-king ","Sarapan sudah termasuk dalam harga","Bisa dikembalikan sebagian",,"Rp","36 m²","Balkon","Pemandangan halaman dalam","AC","TV layar datar","Wi-Fi gratis","Peralatan mandi","Shower","Jubah mandi","Brankas","Bidet","Toilet","Handuk","Seprai","Stop kontak dekat tempat tidur","Lantai keramik/marmer","Meja kerja","Area tempat duduk","Pintu masuk pribadi","TV","Sandal","Telepon","Pembuat teh/kopi","Kamar mandi bersama","Kamar rias","Ketel listrik","TV kabel","Layanan bangun tidur","Lemari","Semua unit terletak di lantai dasar","Lantai atas bisa dicapai dengan lift","Papan Jemur Baju","Tisu toilet",,,,,,,,,,,,,,,,"2","4.887","Kamar Deluxe King","true"," 2 single ","Sarapan sudah termasuk dalam harga","Non-refundable",,"Rp","36 m²","Balkon","Pemandangan halaman dalam","AC","TV layar datar","Wi-Fi gratis","Peralatan mandi","Shower","Jubah mandi","Brankas","Bidet","Toilet","Handuk","Seprai","Stop kontak dekat tempat tidur","Lantai keramik/marmer","Meja kerja","Area tempat duduk","Pintu masuk pribadi","TV","Sandal","Telepon","Pembuat teh/kopi","Kamar mandi bersama","Kamar terhubung","Kamar rias","Ketel listrik","TV kabel","Layanan bangun tidur","Lemari","Semua unit terletak di lantai dasar","Lantai atas bisa dicapai dengan lift","Papan Jemur Baju","Tisu toilet","Selengkapnya",,,,,,,,,,,"2","4.398","Kamar Deluxe Twin","true"," 2 single ","Sarapan sudah termasuk dalam harga","Bisa dikembalikan sebagian",,"Rp","36 m²","Balkon","Pemandangan halaman dalam","AC","TV layar datar","Wi-Fi gratis","Peralatan mandi","Shower","Jubah mandi","Brankas","Bidet","Toilet","Handuk","Seprai","Stop kontak dekat tempat tidur","Lantai keramik/marmer","Meja kerja","Area tempat duduk","Pintu masuk pribadi","TV","Sandal","Telepon","Pembuat teh/kopi","Kamar mandi bersama","Kamar terhubung","Kamar rias","Ketel listrik","TV kabel","Layanan bangun tidur","Lemari","Semua unit terletak di lantai dasar","Lantai atas bisa dicapai dengan lift","Papan Jemur Baju","Tisu toilet","Selengkapnya",,,,,,,,"2","4.887","Kamar Deluxe Twin","true"," 1 super-king ","Sarapan sudah termasuk dalam harga","Non-refundable",,"Rp","36 m²","Balkon","Pemandangan laut","Pemandangan kolam renang","Kolam dengan pemandangan","AC","TV layar datar","Wi-Fi gratis","Peralatan mandi","Shower","Jubah mandi","Brankas","Bidet","Toilet","Handuk","Seprai","Stop kontak dekat tempat tidur","Lantai keramik/marmer","Meja kerja","Area tempat duduk","Pintu masuk pribadi","TV","Sandal","Telepon","Pembuat teh/kopi","Kamar mandi bersama","Kamar rias","Ketel listrik","TV kabel","Layanan bangun tidur","Lemari","Lantai atas bisa dicapai dengan lift","Papan Jemur Baju","Tisu toilet","Selengkapnya",,,,"2","5.296","Kamar Deluxe Double dengan Pemandangan Laut","true"," 1 super-king ","Sarapan sudah termasuk dalam harga","Bisa dikembalikan sebagian",,"Rp","36 m²","Balkon","Pemandangan laut","Pemandangan kolam renang","Kolam dengan pemandangan","AC","TV layar datar","Wi-Fi gratis","Peralatan mandi","Shower","Jubah mandi","Brankas","Bidet","Toilet","Handuk","Seprai","Stop kontak dekat tempat tidur","Lantai keramik/marmer","Meja kerja","Area tempat duduk","Pintu masuk pribadi","TV","Sandal","Telepon","Pembuat teh/kopi","Kamar mandi bersama","Kamar rias","Ketel listrik","TV kabel","Layanan bangun tidur","Lemari","Lantai atas bisa dicapai dengan lift","Papan Jemur Baju","Tisu toilet","Selengkapnya",,,,,,"2","5.885","Kamar Deluxe Double dengan Pemandangan Laut","true"," 2 single ","Sarapan sudah termasuk dalam harga","Non-refundable",,"Rp","36 m²","Balkon","Pemandangan laut","Pemandangan kolam renang","Kolam dengan pemandangan","AC","TV layar datar","Wi-Fi gratis","Peralatan mandi","Shower","Jubah mandi","Brankas","Bidet","Toilet","Handuk","Seprai","Stop kontak dekat tempat tidur","Lantai keramik/marmer","Meja kerja","Area tempat duduk","Pintu masuk pribadi","TV","Sandal","Telepon","Pembuat teh/kopi","Kamar mandi bersama","Kamar terhubung","Kamar rias","Ketel listrik","TV kabel","Layanan bangun tidur","Lemari","Lantai atas bisa dicapai dengan lift","Papan Jemur Baju","Tisu toilet","Selengkapnya",,,"2","5.296","Kamar Deluxe Twin dengan Pemandangan Laut","true"," 2 single ","Sarapan sudah termasuk dalam harga","Bisa dikembalikan sebagian","Rp","36 m²","Balkon","Pemandangan laut","Pemandangan kolam renang","Kolam dengan pemandangan","AC","TV layar datar","Wi-Fi gratis","Peralatan mandi","Shower","Jubah mandi","Brankas","Bidet","Toilet","Handuk","Seprai","Stop kontak dekat tempat tidur","Lantai keramik/marmer","Meja kerja","Area tempat duduk","Pintu masuk pribadi","TV","Sandal","Telepon","Pembuat teh/kopi","Kamar mandi bersama","Kamar terhubung","Kamar rias","Ketel listrik","TV kabel","Layanan bangun tidur","Lemari","Lantai atas bisa dicapai dengan lift","Papan Jemur Baju","Tisu toilet","Selengkapnya",,,"2","5.885","Kamar Deluxe Twin dengan Pemandangan Laut","true"," 1 super-king ","Sarapan sudah termasuk dalam harga","Non-refundable","Rp","56 m²","Balkon","Pemandangan laut","Pemandangan kolam renang","Kolam dengan pemandangan","AC","Bathtub spa","TV layar datar","Wi-Fi gratis","Peralatan mandi","Jubah mandi","Brankas","Bidet","Toilet","Sofa","Bathtub atau shower","Handuk","Seprai","Stop kontak dekat tempat tidur","Lantai keramik/marmer","Meja kerja","Area tempat duduk","Pintu masuk pribadi","TV","Sandal","Telepon","Pembuat teh/kopi","Kamar mandi bersama","Kamar rias","Ketel listrik","TV kabel","Layanan bangun tidur","Lemari","Lantai atas bisa dicapai dengan lift","Papan Jemur Baju","Tisu toilet","Ranjang sofa","Selengkapnya","2","6.734","Suite Junior dengan Pemandangan Samudera","true"," 1 super-king ","Sarapan sudah termasuk dalam harga","Bisa dikembalikan sebagian","Rp","56 m²","Balkon","Pemandangan laut","Pemandangan kolam renang","Kolam dengan pemandangan","AC","Bathtub spa","TV layar datar","Wi-Fi gratis","Peralatan mandi","Jubah mandi","Brankas","Bidet","Toilet","Sofa","Bathtub atau shower","Handuk","Seprai","Stop kontak dekat tempat tidur","Lantai keramik/marmer","Meja kerja","Area tempat duduk","Pintu masuk pribadi","TV","Sandal","Telepon","Pembuat teh/kopi","Kamar mandi bersama","Kamar rias","Ketel listrik","TV kabel","Layanan bangun tidur","Lemari","Lantai atas bisa dicapai dengan lift","Papan Jemur Baju","Tisu toilet","Ranjang sofa","Selengkapnya","2","7.482","Suite Junior dengan Pemandangan Samudera",,,,,,,,,,,,,,,,,,,,,,,,,,,,,,,,,,,,,,,,,,,,,,,,,,,,,,,,,,,,,,,,,,,,,,,,,,,,,,,,,,,,,,,,,,,,,,,,,,,,,,,,,,,,,,,,,,,,,,,,,,,,,,,,,,,,,,"Hotel","https://www.booking.com/hotel/id/dialoog-banyuwangi-banyuwangi.id.html?checkin=2020-06-25&checkout=2020-06-28&selected_currency=IDR&changed_currency=1&top_currency=1&lang=id&group_adults=2&no_rooms=1"
